{
  "documentId": "doc-sample-0001",
  "title": "Empty Doc",
  "revisionId": "rev-1",
  "tabs": [
    {
      "tabProperties": {
        "tabId": "t1",
        "title": "Tab 1",
        "index": 0
      },
      "documentTab": {
        "body": {
          "content": [
            {
              "sectionBreak": {}
            },
            {
              "paragraph": {
                "elements": [
                  {
                    "textRun": {
                      "content": "\n",
                      "textStyle": {}
                    }
                  }
                ],
                "paragraphStyle": {
                  "namedStyleType": "NORMAL_TEXT"
                }
              }
            }
          ]
        }
      },
      "childTabs": []
    }
  ]
}
